{"id":"OBS-000005","schemaVersion":"0.1.0","recordVersion":"0.1.0","revision":0,"status":"Draft","createdAt":"2026-09-08T10:05:00Z","createdBy":"example-user","updatedAt":"2026-09-08T10:05:00Z","updatedBy":"example-user","sourceLinks":[],"changeSummary":"Initial fictional observation","subjectId":"TOOL-0001","observationScope":"GLOBAL","observedAt":"2026-09-08T10:00:00Z","propertyId":"PRP-000001","valueType":"quantity","quantity":{"value":1,"unitId":"UNT-000001"},"measurementQuality":{"uncertainty":{"value":0,"unitId":"UNT-000001"},"confidenceLevel":0.5}}
