{"id":"OBS-000010","schemaVersion":"0.1.0","recordVersion":"0.1.0","revision":0,"status":"Draft","createdAt":"2026-09-08T12:00:00Z","createdBy":"example-user","updatedAt":"2026-09-08T12:00:00Z","updatedBy":"example-user","sourceLinks":[],"changeSummary":"Initial fictional observation","subjectId":"POL-0002","observationScope":"GLOBAL","observedAt":"2026-09-07T08:00:00+02:00","propertyId":"PRP-000001","valueType":"quantity","quantity":{"value":1,"unitId":"UNT-000001"},"notes":"Fictional delayed entry"}
