{"id":"OBS-000009","schemaVersion":"0.1.0","recordVersion":"0.1.0","revision":0,"status":"Draft","createdAt":"2026-09-08T10:05:00Z","createdBy":"example-user","updatedAt":"2026-09-08T10:05:00Z","updatedBy":"example-user","sourceLinks":[{"sourceReferenceId":"SRC-000001","sourceClass":"V","supportedField":"quantity.value","usageType":"citation","verificationStatus":"Draft"}],"changeSummary":"Initial fictional observation","subjectId":"JOB-2026-0001-OP-001","observationScope":"JOB","observedAt":"2026-09-08T10:00:00Z","propertyId":"PRP-000001","valueType":"quantity","quantity":{"value":1,"unitId":"UNT-000001"},"scopeReferenceId":"JOB-2026-0001"}
