{"id":"OBS-000004","schemaVersion":"0.1.0","recordVersion":"0.1.0","revision":0,"status":"Draft","createdAt":"2026-09-08T10:05:00Z","createdBy":"example-user","updatedAt":"2026-09-08T10:05:00Z","updatedBy":"example-user","sourceLinks":[],"changeSummary":"Initial fictional observation","subjectId":"MAC-0001","observationScope":"JOB","observedAt":"2026-09-08T10:00:00Z","propertyId":"PRP-000001","valueType":"valueRange","scopeReferenceId":"JOB-2026-0001","valueRange":{"minValue":1,"maxValue":2,"unitId":"UNT-000001"}}
