{"id":"OBS-000002","schemaVersion":"0.1.0","recordVersion":"0.1.0","revision":0,"status":"Draft","createdAt":"2026-09-08T10:05:00Z","createdBy":"example-user","updatedAt":"2026-09-08T10:05:00Z","updatedBy":"example-user","sourceLinks":[],"changeSummary":"Initial fictional observation","subjectId":"POL-0001","observationScope":"GLOBAL","observedAt":"2026-09-08T10:00:00Z","propertyId":"PRP-000001","valueType":"valueRange","valueRange":{"minValue":1,"maxValue":2,"unitId":"UNT-000001"}}
